{"schemaVersion":"1.0","project":{"name":"__ARTIFACT_ID__","type":"consumer","basePackage":"__BASE_PACKAGE__"},"runtime":{"version":"${taf.version}"},"capabilities":["web-playwright"],"runners":["testng"],"testDefinitions":{"provider":"file-csv","authoritative":true},"reporting":{"adapter":"allure"}}
