{"schemaVersion":"1.2","project":{"name":"playwright-sauce-demo","type":"standalone-test-automation","basePackage":"com.codinglair.taf.demo.sauce","expectedBuildRoot":".","sutInteraction":"external"},"runtime":{"version":"${taf.version}"},"capabilities":["web-playwright"],"runners":["testng","cucumber-testng"],"testDefinitions":{"provider":"file-csv","authoritative":true},"reporting":{"adapter":"allure"}}

