{
  "schemaVersion": "1.2",
  "project": {
    "name": "qe-132-002-testng",
    "type": "standalone-test-automation",
    "basePackage": "com.codinglair.taf.qualification",
    "expectedBuildRoot": ".",
    "sutInteraction": "external"
  },
  "runtime": {
    "version": "1.3.1"
  },
  "capabilities": [
    "rest"
  ],
  "runners": [
    "testng"
  ],
  "testDefinitions": {
    "provider": "file-csv",
    "authoritative": true
  },
  "reporting": {
    "adapter": "allure"
  }
}